,date,title,id,place,frequency,text
0,19251213,San Antonio light. [volume],/lccn/sn85060004/1925-12-13/ed-1/seq-75/,"San Antonio, Tex.",Daily,"The Li|hth
Wonder of
the World ,Z
THE ancient Greeks catalogued the
“Seven Wonders of the World”
and it has remained for modern
science to now add an “eight wonder” —
the greatest wonder of them all.
Countless ages ago a gigantic celestial
visitor, bigger than fifty Woolworth build
ings, shot through the sky and shocked
and punctured the peaceful surface of the,
earth—a monster meteor of iron, liberally
mixed with diamonds and precious metals
of priceless value. This monster has now
been found.
For more than a dozen years digging
for it has been going on. The attempt
was abandoned, resumed, again given up
as hopeless.
All of this very quietly; advertisement
of the enterprise was not desired. Now,
at length, it has suc-
ceeded, ami of that
success this is the
first announcement.
Think of a meteor
—a “fallen star”—
more than five hun
dred feet in di
ameter and weighing
twelve million tons!
Was there ever the
like? Not so far as
known, certainly, or
anything in the least
comparable to it.
There are other
things to be said
about it, equally re
markable, as will
presently be seen.
It fell a long time
-—at least many
thousands of years—
ago, near the Canon
Diablo, in Arizona. A lot of stories have
been printed about it, speculatively; for,
in striking the earth, it made a hole two
thirds of a mile in diameter and nearly
circular. The hole, four hundred feet deep,
was originally supposed to be a .volcanic
crater. But geologists declared that noth
ing imaginable could account for it except
the impact of a gigantic meteor, which
must be buried,— a huge mass of iron—
deep in the ground.
If the meteor was Jhere it could pre
sumably be reached by digging. Such an
enormous mass of metal would be worth
a lot of money, leaving out of considera
tion the scientific interest.
So digging was undertaken on an im
portant scale, shafts being sunk, supple
mented by drilling to a depth of nearly a
thousand feet. Nothing came of it.
Indeed, as is now known, the drilling
might have been carried to unlimited
depths without striking the buried meteor.
It was not there.
If not there, where was it? The an
swer, as now known, was that it was out
side the cup of the “crater,” beneath its
eastern rim. Why, will be explained later.
It was finally reached by driving an
inclined tunnel from some distance out
side the east rim, westward and down
ward at an angle of forty-five degrees.
The tunnel, a thousand feet long, came
upon the giant meteor at a depth of about
fiv hundred feet. Kight there the work
men’s picks struck an impenetrable ob
stacle.
Now the problem is to get at the mass
and remove it, necessarily in many pieces.
To lift it out entire is impossible. To get
it out at all is a difficult engineering
operation, but, now that its location is ex
actly known the task reduces itself to
mere terms of labor and cost. Already
work has been begun on a deep open cut.
One reason for the difficulty lies in the
Mining Engineers Missed the Most Startling
Mineral Discovery Ever Known Because They
Neglected to Calculate That the Meteor Plunging
Down from the West Would Be Found East of the
Crater. An Angled Tunnel Has Solved
the Mystery.
fact that meteoric iron is one of the hard
est substances known, containing a con
siderable percentage of nickel ordinarily.
It is, in effect, nickel-steel, and its com
position is said to have given the first
hint for the use of such an alloy in the
manufacture of armor for battleships.
It is going to be a big job, therefore,
to break the mass into removable frag
ments. This is likely to be accomplished
by sawing, rather than by high explosives.
But in the meantime the meteor must be
exposed to view and rendered accessible
by mining.
How, it may be asked, can the job pay,
taking the difficulties into vi w? An
equivalent quantity of iron could surely
be obtained elsewhere much more cheaply.
Ah! There lies the most important
point of the story. It is known with cer
tainty that the meteor contains three
fourths of an ounce of platinum to the
ton. How this is known will presently be
explained.
Do you know how much platinum is
worth to-day? . One hundred and fifteen
dollars an ounce! The weight of the mass
underground is estimated at twelve mil
lion tons. It should, then, contain nine
million ounces of platinum, which, at the
price above mentioned, would have a mar
ket value of more than a billion dollars.
Platinum, weight for weight, has nearly
six times the value of gold. It is an ex
tremely scarce metal, indispensable for
many purposes. We have almost none of
it in this country, nearly all of the world's
supply coming from the Urals in Russia
and from Colombia, South America.
But here, apparently, is a billion dol
lars’ worth of this precious white metal,
dropped upon our territory out of the sky.
A miracle, truly. In respect to platinum,
we shall be lifted suddenly from barest
poverty to almost incredible affluence.
Elaborate experiments made by French
The Willamette Meteorite, Found in Oregon, Appears Large Compared
with the Two Boys Resting in Its Crevices, But It is.. Merely a Pebble
Compared with the Monster Mass of Metal Just Located in Arizona.
artillerists not long ago proved that a pro
jectile, striking a mass of rock such as a
cliff, produces an “impact crater” seven
times the diameter of the projectile. The
meteor was, in effect, a projectile, and,
applying this rule, it must have been about
five hundred and fifty feet in diameter
in order to produce the crater here de
scribed in Arizona.
That crater (so to call it) is a most
tremendous dent in the rocky crust of the
earth. Its cup, across the top, measures
thirty-seven hundred feet one way and
thirty-eight hundred feet another way, the
two lines of measurement being at right
angles. The rim, composed of material
forced up by the impact of the meteor in
striking, is a ring-shaped hill two hundred
feet high.
Those figures are needed to give a no
tion of the mightiness of the celestial pro
jectile that hit Arizona in the long ago.
traveling at a speed fifty times that of a
rifle bullet, its impact must have caused
the whole earth to tremble, and doubtless
all Arizona was illuminated for a few
minutes by an uprush of flaming gas.
<C> USS. by American Weekly. Inc. Great Britain Blibu Referred
This Gigantic
Meteor Crater in
Diablo Canyon,
Arizona, Has
Revealed Its
Age-Old Secret
—lt Hides a
12,000,000-
Ton Lump of
Solid Iron,
Nickel and
Precious
Platinum
Sprinkled with
Diamonds.
The huge projectile entered our atmos
phere a cold body—so cold that a chunk
of ice would be hot, comparatively speak
ing. The temperature was the absolute
zero of outer space, 371 degrees below
the zero of the Fahrenheit thermometer.
But, passing through the atmosphere with
such incredible swiftness, it was set on
fire by friction, the outer part of it being
melted and, to some extent, vaporized
The giant meteor struck Arizona slant
wise, coming from the west. If it had
descended vertically it would have been
found by digging inside the cup of the
crater. But, coming down at an angle, it
lodged deep down beneath the rim of the
crater, on the east side. The easiest way
to reach it was by starting an inclined tun
nel from some distance outside the rim
on that side, driving it downward and
toward the rim as already described.
Hundreds of fragments, melted and
broken off from the meteor, have been
found in the near neighborhood of the
crater. Their character is unmistakable,
inasmuch as meteoric iron is in structure
and composition unlike anything else in
Science Finds a Meteor,
50 Times as Big as
the Woolworth
Building, Full
of Diamonds
and Priceless
H Minerals
This Remarkable Airplane View of Diablo Can
yon’s Eight Wonder of the World Indicates Clearly
How the Surface Rock Was Ground to Dust and
Splashed in a Wide Ring, Just Seven Times
the Size of the Meteor.
the world. One of them weighed over a
thousand pounds. All of them were found
on the west side of the crater; none at the
east side. This was good evidence that
the meteor came down with a slant from
the west and toward the east.
In some of the fragments diamonds
were found, colorless, yellowish, blue, and
black. Most interesting. It is supposed
that they were crystallized out by high
heat from carbon in the nu teor. They
were too small to have any commercial
value, but Dr. George F. Kunz, the
famous gem expert, obtained half a
carat’s weight of them by dissolving a
considerable quantity of the iron. Many
that were mounted on glass slides for mi
croscopic examination exploded and dis
appeared. Big diamonds, taken front
mines, sometimes do the same thing.
Formed by volcanic agency, they may en
close cavities filled with gas at v< ry high
pressure, and so fly to pieci s.
The notion originally entertained, that
the hole in Canon Diablo wa> a volcanic
crater having long ago been dismissed,
geologists were led to speculate regarding
its origin. Prof. Grove K. Gilbert, of tie
U. S. Geological Survey, was first to call
attention to its likeness to the so-called
craters of the moon, which latter, he be
lieved. were scars made by the impact of
“moonlets” that formerly traveled around
the earth in flocks, eventually to be swal
lowed up by the lunar orb.
If so, why might not a giant meteor —
call it a mooniet if you choose—strike
the earth and make just such a crater’
Further study convinced geologists that,
whether Prof. Gilbert’s theory about the
moon was correct or net. the Arizona
crater was almost certainly to be attrib
uted to the impact of a. celestial body.
One of them. Dr. Daniel Moreau Bar
ringer, who was a man of means, backed
the idea with money, and undertook to
sink shafts in the big hole.
He found the surface rocks, limestone
and sandstone thoroughly shattered to a
depth of three hundred feet, as if by a
Imagine a Shrieking, Flaming Star
Weighing 12,000,000 Tons and 50
Times as Big as the Woolworth
Building Crashing with Terrific
Impact Into the Upturned Face of
New York — Picture a Gaping
Crater, a Mile Wide, Containing
the Pulverized Debris of What
Was the Heart of the World’s
Greatest City — Impossible?—No.
It Really Happened, Rut Luckily
It Landed in the Arizona Desert
Instead of the Metropolis.
tremendous blow; anil the sand grains
composing the sandstone were fused as
if by high heat. Churn drills were pul
down to much greater depths, reducing
the rocky stuff to mush and bringing up
samples of it. The
thinking on the problem and proceeded
once more to tackle the job.
He has found the meteor. Doubtless a
lot will soon he printed about it in the
newspapers, but this is the first announce
ment. There will be plenty to be said
when the mass is exposed to view and the
wealth it represents has been rendered
available.
Obviously, this meteor, if only by rea
son of its enormous size, reduces the
largest ones hitherto found to an im
portance r< latively trifling. The biggest
heretofore known is the famous Peary
meteorite, found by the Arctic explorer
at Cape York, in Greenland, weighing
thirty-six and a half tons. That meteorite
may be seen today at the Museum of
Natural History in New York.
The next largest meteorite is now in the
city of Mexico. It is shaped like a ham
and weighs about twenty-five tons. It
was found in 1900 by the late Prof.
Henry A. Ward. Mexico.
The third largest meteorite, and the
biggest <>ne ever found in the United
States, is the “Willamette,” now owned
by the Museum of Natural History’ in
New York. It is ten feet long, six and a
half feet high, and four feet three inches
thick, weighing 31,107 pounds.
The finding of platinum in a meteor
altogether new. From a merely scientific
viewpoint, therefore, the presence of that
rare and precious metal in the Arizona
“fallen star” is of utmost interest. Add
to that the diamonds it contains possibly
there may be some big ones in the me
tallic mass—and you have something
worth getting excited about.
Think of a mass of meteoric iron five
hundred and fifty feet in diameter! Con
sider the platinum it contains the most
precious of all metals. A billion dollars'
worth!
A worthwhile “star” indeed. Although
a small one, rich. How wonderful that
such a mass of wealth should be sent to
us by an accidental shot out of the void
of cosmic space.
I '<ll I ' "" ! ■ • •
were v< ry interest
ing, but the meteor
ri mained undiscov
ered.
Dr. Barringer
gave it up. Then
the U. S. Smelting,
Refining & Mining
Company took uu
the job and kept at
it for years, sinking
shafts and drilling.
After spending hun
dreds of thousands
of dollars, it quit.
What was the use?
The meteor was not
there.
In the meantime
Dr. Barringer had
been doing a lot of
5"
1,19461101,Scandinavian American. [volume],/lccn/sn87093436/1946-11-01/ed-1/seq-6/,"Seattle, Wash.",,"6
large Meteorite
Found In Sweden
STOCKHOLM.~An iron me—l
Icorite weighing 15 kilograms was
recently found in a layer of sand
and gravel 1.2 meter deep at Kit
1(‘joki village in northern Sweden.
- “w . \\ \\\‘.&V§\ ' : -\' , “=2.“- WH ,.
H“ ’- w} if'ztiiiiirﬁiiiis '“*21""3.:355i1é2iiﬁaasﬁazleaz3%; \ ﬁ- 9.5.3:. .j_.;:§2§€5‘-‘i"" VI- t
Ni - § 'I‘ 3* i
/' \‘t‘ \1 3 ” -\
a \ . . . ._ ‘ '/. ~. I ‘
\1: \ , 1’s"" 1
1 x l éf‘e ~ l ;
f’/ , ' 2322:5231 .-‘ . 1 ..
44'. ‘ ‘25,.- '. ‘. f;
4? Xi “ . ’ ' j 15""
ﬁzn ’ /, a: l,‘ 2 s"" f. :- ~.
</%‘ / I/ﬂI/y ,_?' } x ’ k \.
.. .4 ‘ I/V Ayyd/ ‘ _ 51; 51.61:» ! \x.‘ \
t /'wc'"" ,. ' ‘ [3: 3v.
‘ - , V -. ' //-._j:,/ :.i';r\§_-’ .’ ‘ .' t m z .2;
:_ '3‘ - ‘m/x’f; ' W3}: .ml' 5’? '
\J/yeétz’a/ ' .. 1* l »- :""--..
\=:1-:;’;§} —//// “3“ '\\\'ﬁ':':5=-;I.V‘ l '6'
r"" h “ 521;»: ”3%
.. {5"" » . WVV/ \ “V's-«gt 132.5535 .3: *3
Léeltése.ies= :/ é‘ \\
.4 famous dessert wine of ruby One of the oldest wines hoe-m
color. produced from grapes . . . served all over the world
A wine grown especially to go
with fruit. cheese or min
on Is a rich sweet red wine that goes ideally with desserts
Por with light refreshments. Port wine is produced from fresh
ripe grapes. It is a product of the farm as are all true wines.
To produce Port. the vintner picks his grapes when fully ripe
and hence at their greatest sweetness. Stems are taken off and
grapes crushed. But the grape skins are left in the vets during
fermentation—that is what gives Port its ruby color.
In order to retain some of the natural grape sweetness in the
wine. the \‘intner adds a small amount of grape brandy to the juice
as it is fermenting. This stops the fermentation and leaves the
wine with its rich l’ort flavor. Port is then aged. bottled and ﬁnally
is ready for you to enjoy. Try serving small glasses of Port next
time you have guests at your house. Wine Advisory Board,
., /;5.;f;/’/-~""""':M a4./tsfg’éi”17‘”7’r"" .-
.- I , , w’~*-:~ ._ 1%..
\gﬁw:/ . \sﬁem ""1"" -
. 1 ./ ‘2"" z , . g, ""x ._ M‘ _
. ‘- f - -.""‘._-\‘,-_ ' '
V‘fhen you ask for Rainier Beet by name
you me assured of obtaining one of the
wcrld's-truly fine beers. It costs no more
to enjoy and serve this Nationally Famous
product.
SKKS' mm: mm ‘ “1““ C0.
Smce 1878 * E. G. Sick. Pm.
'WASHINGTON'S 01.0551 INDUSRIAL INSTITUTION
Only once before. in 1906, had a
3similar find been made in Sweden,
land in just about the same area.
iMost probably both meteorites or
i iginated from the same fall.
The newly found meteorite has
I been acquired by the National Mu
seum of Natural History in Stock
holm. where it will be added to the
‘extensive mineralogical collec
tions. l
o
364} Ram
Norway's United
Nations Delegates
Now In Action
NEW YORK. N. Y.—Members
of the Norwegian delegation to the
United Nations Assembly arrived
at LaGuardia Field, New York.
on Monday, October let, aboard
a special flight of the Scandinavian
Airlines System. The Norwegian
delegates include: Foreign Min
ister Halvard M. Lange, delega
tion chairman: . Wilhelm Morgen
stierne, Norwegian Ambassador to
the U. S.; C. J, Hambro, President‘
of the Odelsting (House of Par- ‘
liament); Terje Wold, Norwegian
Supreme Court Justice; and Firm
Moe. permanent Norwegian dele
gats to the UN. Alternate dele-‘
gates include Dr. Jacob S. Worm
Muller, J. Strand Johansen, Mrs.
Aase Lionaes, Dr. Frede Castberg,
and Ole Cobjornsen. Mr. Aake
Ording, Mrs. Ingrid Semmingsen,
Col. 0. Munthe Kaas and Captain
Kristian Ostby R.N.N. are listed
as advisors to the delegation.
One of the first public state
ments to be made by a member
of the delegation upon arrival here
was that of Supreme Court Jus
tice Terje Wold. During a radio
address on the evening following
his arrival. Mr. Wold stressed the
Significance of this first U.N. As
sembly meeting on American soil.
“It is a good token,” he noted.
“that the United Nations take up
its work here in the land of Wil
son and Roosevelt—the two great
presidents who lived and died for
peace and security on earth."" Out
lining Norway‘s position on the
question of large and small pow—i
ers, Mr. XVold emphasized that the}
task of the small nations lies first‘
and foremost in the social and eco
nomic fields—in the field of inter
‘ national character building and en
llig‘htenment. “It has been said
gthat the United Nations organiza
1 tion is undemocratic and especially
liliat the small nations have too
little influence."" declared - the
'speaker. “We in Norway can not
Eiegaiii the matter m this light.
!War will not come to us if the
ggreat powers are in agreement.
iThei'efore. as long as the great
‘powers cooperate on the founda
tion set forth in the United Na
;‘tions Charter, it must be correct.
Hn terms of practical politics. that
7 they also assume responsibility for
[the peace and security.""
Pastor Came To
Astoria In 1876
ASTORIA. Ore—Seventy years
ago the first Lutheran pastor to
be sent out by an established
church arrived in Astoria. It was
in the year 1876 that the Rev.
Emil Gustav Andreas Christensen
was sent here by the Norwegian
Evangelical Lutheran Synod to
conduct services.
For several years First Nor
wegian Lutheran congregation as~
sembled in cannery warehouses
and other buildings. but the
church lived on. The congregation
commemorated the coming of the
first Lutheran pastor to Astoria in
a. special service on October 13.
Dr. H. L. Foss. president of the
Pacific District. delivered the ser
mon at the festive service.
Pastor Christensen remained in
Astoria from 1876 to 1879. Fifty
years later. his son. the Rev. M.
A. Christensen. became pastor at
the ""church founded by his father
and served it {or 10 years.
Mrs. Theodore Guihauzen. wife
of the present pastor of First Nor
wegian Lutheran Church. is a
granddaughter of the founder. His
great-grandchildren are also ac
tive in the congregation. They in
clude Martin. Grace, Rumohr and
Kathryn Guihaugen, Marilyn and
Martin Christensen.
THE SCANDINAVIAN AMERICAN
Pacific Lutheran
To Get Buildings
WASHINGTON, Nov. 5.—— Pa
cific Lutheran College. Parkland,
i
0
Mr. Fisherman:
' T cAsH Prices
P .
Paid for all species of fish livers based on actual
vitamin content. We will test them for you at
once or accept assays of any recognized com
mercial laboratory.
Assay equipment at our own stations in Everett,
Blaine, and Seattle, Washington; and Astoria,
Oregon, for your convenience. Our agents at
other ports can give you top service.
Sell direct to the manufacturer for best prices.
Washington Laboratories
Bell Street Terminal ' Seattle, Washington
BUYING STATIONS AND AGENTS
Juneau and Pelican City......,. ... ..Alaska Coast Fisheries
Ketchikan, Alaska . . , . ..... “Alaska Fish Products
Wrangell, Alaska . .. ._ ,. ..R. H. Armstrong
Petersburg, Alaska .. .. Knut Thompson
Sitka. Alaska... .. . .McCallum Legaz Fish Company
Tyee, Alaska..... . . ' Sebastian Stuart Fish Company
Vancouver. B.C.......' .. ., . ......Washington Laboratories
Blaine, Washington .. , , .....Washing'ton Laboratories
Anacortes. Washington....... . ...,,,.......Sebastian Stuart Fish Company
Bellingham. Washington .Dahl and Beach Fish Companies
Everett. Washington . .. .. .... . Washington Laboratories
Westport. Washington . . . Kaakinen Fish Company
Hoquiam. Washington ,. .. Paragon Fish Company
Bay Center. Washington. . . . ..Haines Oyster Company
Coos Bay. Washington . . . Chas. Feller
Astoria. Oregon Washington Laboratories
Eureka. California .. Tom Lalio Fish Company
San Francisco. California . . Frank Alioto Fish Company
Santa Barbara. California... . . ..(ieorgﬁ V. (Yastagnola
[.05 Angeles. California ., Bert A .Ghio
Los Angeles. California. . . . Washington Laboratories
Esquinnpu. Mexico Carlos Gorostiza A.
, j. ., ./, /  ) é , My
, ’, ,/v , ,r , 2 £1 ’\ gﬁﬂ,“ ‘
, '2’» % "" W
1"" 7 ‘ ’ m y\
\t‘ M "" ‘ , 43%: ”9‘5
l‘ 41* 71‘1“}31k , 1°“
. 9-1. (9“ ""
‘3 ‘ , 7’le ‘ k f
, .3. 1:. \ fr 3 .
Yb 9 it ‘
i ., , 3:} -
W .» ,3@' C”... '2
if? . 1’3“” »—-'. (gr ’ ,
. ’A ;.'
“Won“ Y2! “ ’é~ _ as
ﬂow under “a
Grapes!
5
NOW AND THEN in our mte A few Eco le get worried about ""fortiﬁed
wines."" To them . . . md they're undou ugly tincere . . . this term mews
something hnrmful. They do not realize. for exam le, thut Port, Sherry and
Muscatel are nll made (fortiﬁed) with pure gape irandy added. to W
the natural sweetness of the grapes and to maintain the traditional cﬁlncter
of thee: pmiculu wines.
What these peogle undoubtedly ure trying to uy is that theta thould be
no ""synthetic."" 'Iu standard.""or""imitation ’ wines permitted to beptoduced
or sold in the State of Wuhin ton. These may be humful. In this, the wine
growers of Washington heartify concur.
But Port. Sherry and Muscuel are not “synthetic,” ""luhtmdu’d"". 9f
""imitation"" wines. They are pure, natural fruit products. And to prohlb""
their sale would eliminate the market {or nppronmuely 25 per cent of (h.
grapes grown in this ante.
We don't believe that any”: in ”116131be mm to tbs-(kind) ""I,""
andcr"" m pnm! ”table grape IW‘O. ’
' ~ A 5‘.
'vu'oddMMI-ulnhohuduou—u ; 7
ubmc-On.avnduhH-nu~-ndwhn. 3‘""
and rant-oil. “GNU-Wu“ LU. H“, -‘_‘ 4
Maw“. . ‘.
WASHINGTON WINI COUNCIL
AN ASSOCIATION OF GIOWERS AND PRODUCERS
Wash., today received Federal
Works Agency approved for gov.
ernment surplus buildings to per
mit enrollment of 300 more stu
dents.
The increase will bring enroll.
ment to 900, including more than
500 veterans, the agency said."
