,date,title,id,place,frequency,text
10,19020323,The San Francisco call. [volume],/lccn/sn85066387/1902-03-23/ed-1/seq-7/,San Francisco [Calif.],Daily,"quartz colored .by nickel. A' large quan
tity of ""'this-, stone -has been found, neai
VJsalia, and Eastern jewelry firms are
buying, much of it. • ¦_., • •¦ . , ,;,•,,.. -
¦:, The foreign sounding name of aragonite
is given U6, one of the mosf.beautiful of
the stones of California, it Is a form
of. marble' : popularly called onyx,- and
much of.it comes from San Luis Obispo
In I the'> specimens • of the museum many
tints are 'found; from the green of the sea
to the rose pink of the. dawn, and ""the
semi-translucent stone shows strange'de
signs ranging ' through its coloring; in the
.„ ¦•¦¦•¦ -,-'.'¦'. .' ¦' . ¦ •
shape of fantastic clouds, battlements and
mountains. - Other ¦marbles.-in the'collec-
tion are the ""sky blue""; fromthe quarries
near Riverside, named from.its color, the
rich green of verde antique, and the,roso-
colored layers,of travertine, all found in ¦
California. ;.;.' :::..-. *""..-"" '
-¦'Among; the-mineral curiosities are some
smair pieces of what. 1 you. would take at
first 'glance to. be:.'bits of'flesh-colored
marble, v These are specimens of hydro-
phane, a.variety of opal found .in River-,
side County. This opaque stone has'a
wizard-like, quality. -Drop a: bit of. it In
¦V.-j '-' - - ;: •¦ *. '•""¦ ¦.;.'• '.-: .• ¦ - ... ,
.plants from Utah, where they are worked
as silver bearing ores, the fossils being
permeated by a silver bearing solution,
probably found in the natural waters that
flowed over them. A pretty mineral of an
amethyst hue is . rulillated quartz.^shot
through with fine-threads of rutile. This
mineral is^popular known as arrows of
love.-and many Is the heart-shaped trink
et:that has been fashioned from It and
given :¦ to a sweetheart.- • Coal in many
stages is shown, and reposing In a case is
a model of the first gold nugget found at
Sutters Mill in 1848 by Peter L. Wimmer,
'who said to his son: .""Take this to your
'
clear water and watch it. Beginning at
the edges it grows translucent and milky
before your eyes, till you wonder If it
will not disappear entirely. Take it from
the water and in a moment or so the
solid marble is again before you. Special
cases are given up to the large families
of the quartz, the jasper and the chal
cedony,'among which come the varied
hues of ' the amethyst; the opal and the
• moonstone.
In a case there is an . imposing gilt
model of the largest gold nugget* known,
the Welcome, which was probably very
true to Its name when found near Bal
' larat, Australia. The weight of the orig
inal was 2166 punces troy.
A big cube of pumice is a queer mineral
compound— once a rock full of gases
blown by volcanic action into a cell-like
of. natural glass. And just aa
'strange, but' more beautiful. i$ a big
jagged piece of obsidian, which is what
was once granite, now melted by natural
causes Into glass. Sheets of this strange
. mineral are found in Napa County.
• There are sheets of a milky white
transparent mineral in a case. They are
seUnite (sulphate of calcium), one of the
varieties of gypsum used In the cOmposl
. tion of plaster and plaster of pari3.
A mineial that Is elastic is another of
nature's freaks. The popular name, min
eral leather, which it receives from its
.' stretching.' qualities, is an easier one to
remember than pilinite. the name given
it by the mineralogist. It is found in
whitish sheets very much resembling as
bestos, and ' specimens have been taken
. ¦ ""from crevices in the Almaden quicksilver
mine.-
There is an interesting collection of
- mollusks and fishes also in the museum,
among them some 'large oyster she^l fos
sils. . ¦
The museum represents the mineral in
dustry and aims to show the methods by
which the crude ores are prepared for use
""and market. A relic of old mining me^h
f ods Is a. wooden rocker with its two tin
dippers, which probably once stood by the
bank of some creek that had golden
sands.' . .
There are some fine specimens of the
turquoise, now so fashionable, which la
quite extensively, mined in California.
From Alameda County come some spec
imens of magnesite, or carbonate of mag-'
nesia, a mineral which will some day be
extensively used In • the. manufacture of
magnesia brick. ¦
In the midst of a lot of mineral bristles
the Jaw and teeth of a mammoth frcm
•Santa Rosa Island. The clays, borax and
other minerals of commercial Importance
Rre arranged by themselves In groups, and
the same arrangement extends to gold,
silver, copper and minerals- of economic
importance. An interesting feature 13 an
extensive collection of Italian marbles, as
well as building stones, from other parts
of the United States. Of much curious
Interest are some specimens of fossil
The o^d headquarters of the bureau wer-»
«n Sutler street, near Grant avenue, and
were not so commodious as the present
or.et, though even now more space could
be used with advantage. The headquar
ters in the ferry building as now occu
pied Include the office of the State Min
eralogist, Lewis E. Aubury: the museum.
In charge of J. M. Hyde, curator, with J.
M. Ciine as assistant; a well equipped
library: -the headquarters of C. S. Long,
the secretary and librarian, and C. O.
Duhain. assistant librarian. In the next
loom, which Is the draughting depart
ment, where the maps are made, Shirley
baker is the busy man in charge.
One of the most enthusiastic depart
ments of the bureau is the laboratory,
vhere E. B. Preston, the assistant min
eralogist, is kept busy classifying sam
ples of minerals trreit are sent in. This is
done free of charge, and any one may
Front an educational standpoint if none
cthei these people would rind the museum
u most interesting- spot to visit. Its ex
hibit of sixteen thousand mineral speci
n.tns ranks among the finest collections
iv the world. In it are specimens of each
c!ass or variety .of every known mineral
in the State of California, and if any
form of a certain mineral is needed that
this State does not produce It is secured
from another State or country. Ey an
act of the Legislature approved April 16.
1.NSC. the bureau came into existence and
has been kept up at the expense of the
Siate ever since.
THE register on which visitors who
are seeing the sights inscribe their
names at the museum of the State
Mining Bureau in the ferry build
ing shows an average of one hun
*t*c and fifty people daily, embracing all
classes, from the student of mineralogy
and the prospector to the idler who a.sks
Isnpossibie questions of the curator; Last
year there was a registration of fifty
eij,'ht thousand visitors, besides the many
who omitlc-d to leave , their signatures.
Still, there are people in San Francisco,
and not a few of them, to whom the Stat.o
Mining Bureau Is an region,
if not an unknown one.
send in anything in the shape of a min
eral that is found in the -State and see
whether he has found diamonds or gold.
Nc assays or quantitative determinations
are made, but simply classsifying or iden
tifying, and the bureau has been instru
mental -in the discovery of many ' new
ores through the work of the iatxiratory.
Mr. .Preston has the assistance of.C. J.
Ysile. statistician, and they are both kept
bv.sy. Just now there are many samples
of black Band with platinum brought in,
for there is much inquiry about that pre
cious metal at present One man some
times brings in as many as twenty-six
s-amples of ore or mineral with the re
quest, ""Please tell me what this is.""""
The samples are put through a chemical
analysis and the man is tola the different
materials they contain. Miners ate often
sent to this department also when the
rush of business Is great with the State
Mineralogist, to find out how to work
ores, processes, etc. Capital from New
Jersey and New York is making inquiry
about the fine limes and clays of Cali
fornia and v San Francisco capital is in
terested also in the construction of plants
for the manufacture of cement. • It I is
expected that there will be a great' de
mand for cement later in the Orient and
manufacturers can ship the product frpm
here by way of Manila. In this depart
ment of the bureau one can see. . if he
be so disposed, the beauties of a common
rock as shown through a fine microscope,
and it will be found to be no mean, item
among nature's wonders. About two
hundred and fifty to three hundred- and
fifty samples of various rocks and. ores
are submitted to the laboratory every
month through the mails and by people
personally. This is one of the results ot
the industrial standpoint, so to speak,
from which the mining bureau is being
operated by Mr. Aubury, who has dis
carded old methods and is carving out
a way for himself. The bureau prepares
and issues a register of mines from each
county of the State, with maps showing
locations, etc. These maps are . a new
feature that no other -mining bureau In
the country has. Mr. Aubury also i»
keeping himself busy In the Investigation
of all the. doubtful propositions, that he
can get at in the way of oil wells or
Many people do not know that diamonds
have been found ; in California. , -• Yet | herb
they are, good sized ones, sparkling at
you from the glass case where they havt>
rested since they were sent from the mln-
Ing sluice boxes in Butte County,', where
they were found. Some have been found
in Amador County also, and one man 1j»
said. to have found as many as fourteen.
These finds are being investigated further.
Another semi-precious ""stone ; qf. a rich
green in-huo; is chrysoprase, which is
- It Is the intention of 1 Mr. Aubury to
gradually pay more attention to industrial
and structural materials.- There is a de
mand for this: Many people who are shy
ai>ouf raining ¦ propositions display some
interest in bther materials, such as useful
woods and stones. If possible it is in
tended to gather an^exhibit of structural
materials and issue, bulletins regarding
the- locations, where these materials are
found, the uses , of them, etc;
Among the specimens: in: the museum
there are many minerals that are beauti
ful to look at as well as. rare and val
uable. Under this last head comes plat-'
inum, of the various forms of which there
is a fine collection'. ' From San Diego
County comes some very large specimens
of a beautiful purplish stone, . known to
the trade as. rubelite, from which rings'
and other trinkets are made. . .. ¦ ,
mining- properties or '-companies, thereby
protecting unwary • investors. He is
thoroughly posted and he can put -'his
finger on one of the maps of the bureau
and tell you just how. long this mine has
been"" worked, how .long ;this oil well'has
been producing and tne output of both
of them, etc. The 'bureau issues a re
port annually and.is now issuing bulletins
for distribution on special. subjects., which
include copper . and .quicksilver mining
and the saline deposits of California.
Also information regarding gold dredging
in California and the gems and precious
stones found in , the State. The bureau
also statistics of the mineral
production -of each county of the:State,
With , valuations df the J yearly product.
They now have in preparation ten mapa
with registers of mines in various coun
ties. A yearly appropriation is made of'
$25,000 for the bureau and its field work,
with an extra $5000 per year for; printing
Any Information regarding the mineral
waters of California may be found at the
library also. i
Now the library has a good list of works
upon the subjects of smelting, refining,
gold milling and assaying, oil refining,
precious stones, structural materials and
many other things which the progressive
miner cr prospector wishes to be informed
upon. But whether seeking 1 for . knowl
edge or upon pleasure bent, the State Min
ing Bureau is an interesting and instruc
tive place in which to ?pend a spare hour
or two. ALFRED DEZENDORF.
To the library come many miner* and
men seeking information about the min
ing resources of California and mining
properties submitted to them for sale and
it is the aim of the librarian to supply
such data. Publications now being printed
on copper and gold dredging will fill a
great need. The new methods of yold
dredging used in Australia have been used
In the northern part of the State with
profitable success. The Inquiry for gold
mining properties is stronger than for
many years and gold mining has seen a
great revival in northern and other coun
ties. Prospectors are increasing. Large
capital is becoming interested in Califor
nia gold mines, much from. Ohio, Massa
chusetts and Illinois, while New York al
ways stands ready to put money Into a
favorable proposition. Much correspond
ence is answered from the bureau regard
ing slate, and slate quarries will be an im
portant factor in California one of these
days.
A force of men are always kept at work
in the field gathering statistics and other
information for the mining bureau and Its
publications. In the drafting room Is pre
pared all the matter for the illustration of
the various publications and the maps are
made there also. Work is now being done
on maps of Placer and Shasta counties,
showing the various mines, accompanied
by registers.
A working model of a stamp mill is a
thing of much interest to those interested
in gold mining. In a glass case la the
famous San Bernardino meteorite,, found
in the Manipah mining district. San Ber
nardino County. It weighed 128 pounds
3*4 ounces avoirdupois. The following
analysis shows the various constituents of
which the monster meteorite it composed.
Iron, 94.94; nickel, 4.52: phosphorus, .07;
graphite, 10. Total, 99.67.
A curiosity with a history is a section of
a tree blazed by Kit Carson in 1S44. It
formerly stood on Carson Creek, Alpine
County, on the main divide of the Sierras.
Another section of a tree shown has pro
truding from it the handle and corner of
a coffee mill. A miner tacked it there
and then shifted camp and forgot it. But
the tree went on growing until the cof
fee mill was enveloped and close to : the
heart of the tree until only the small
part of it was left that is now visible. A
curious mass of pipes molded in brown
metal is the large specimen of stalactite
limonite, from the Iron Mountain mine,
Shasta County. •
1 A primitive mining souvenir is the Mexi
can ladder, which is the trunk of a tree
filled with notches like steps, once used
in ihe New Almaden mine, Santa Clara
County. Nothing more richly grained
and colored in the way of natural wood3
can be found than the large slab of
molave wood from the Philippine Islands
exhibited here. It much resembles black
walnut, but with more shadings of brown.
mother and teil her to boil It in her soap
kettle."" This was the test by which tha
nugget was proved to be gold.
7
THE SUNDAY yC&JLJL. =
CALIFORNIA STATE MINING BUREAU"
11,19060217,Truth. [volume],/lccn/sn85058310/1906-02-17/ed-1/seq-10/,"Salt Lake City, Utah",Weekly,"I 10 tru tm,
I RAILROAD DIVIDENDS.
B L. J. Bryant, cashier of tho Dank of
H Arlington, Ky., writes to tho Manufac-
H Hirers' Ilecord as follows: ""How
H many railroad corporations pay In ex-
H cess of G per cent dividend on tho in-
H vestment? Great sums are earned an-
H nually, It is true, often Into tho mil-
H lions of dollars, but when fixed and
1 operating charges are paid the net
H earnings aro often small, and tho
H country at largo Is tho benellclary of
theso enormous earnings In the wny
of interest on bonds, wnges paid to
H employes, etc., and It flows right back
H Into tho channels of trnde.
H ""Tho relations of tho railroads and
H tho farmer, manufacturer and mer
M chant are so closely interwoven that
H tho success of ono depends largely
m upon tho success of tho other; thoy
H havo gono hand In hand for decades in
H civilizing and In developing the ro
M sources of tho country. The better
H Bervico the railroad can maintain for
H tho handling of tho various comniodl
M ties of the different sections of tho
H country and the manufactured prod
m uct, tho greater will bo tho success
H of tho farmer and manufacturer;
M whllo on the other hand, if the ave
M nues of transportation are blocked by
M injecting into them a condition ovor
M which their mnnagers have no control,
B to that extent tho business cammu
H nlty will wane; the farmer, the manu
al factum- and the merchant will feel
M tho consequenco of it, and soon it will
M pervade every nook and hamlet of the
M country.
M ""The same underlying principles ob-
M tain in railroad business ns do in al.
M other business; when the earnings are
M decreased without a correspond n.
M curtailment of expenses tho business
M Is imperiled, and to meet this deficit
H In earnings the high class service
H must be Impaired, and when this is
M dono the slipper suffers and the entire
M country sustains a pecuniary loss.""
M Do Sk' s Rain Diamonds?
M Do the heavens rain diamonds? BI
M zarre as miy appear Meydenbauer's
M theory that the diamond is of cosmic
M origin and has fallen as a meteorite at
M later periods of the earth's formation,
B there are evidences thereof, tho most
m striking confirmation coming from
M Arizona. Hero on a broad plain, over
M an area of about Ave miles In dlame-
M tcr, had been scattered ono or two
M thousand masses of metallic iron, the
M fragments varying In weight from half
M a ton to a fraction of nn ounce. There
M was little doubt these masses formed
M part of a meteoric shower, although
M no record existed as to when the fall
M took place. Curiously enough, near
M the center whero most of tho meteor-
M ltes had been found, was a crater with
M raised edges three-quarters of a mile
M in diameter and about COO feet deep,
M bearing exactly the appearance which
M would be produced had a mighty mnss
m of Iron struck the ground and buried
m Itself deep under tho surface. An an-
m clent meteorologist In cutting a sec-
M tlon of this meteorite found the tools
M were Injured by something vastly
M harder than metallic Iron, and soon
announced that he had found black
M and transparent diamonds. Since this
M revelation diamond hunting In meteor-
M ltes has occupied chemists all over tho
M world, some of whom, like Sir William
m Brookes, havo made a successful find.
M So look nut for meteors. They may
M contain diamonds.
M Jap Takes Up Schopenhauer
B Tho works of Schopenhauer aro be-
H lng translated into Japanese by a
M young Japanese professor at Toklo,
M who holds that Schopenhauer's doc
1' trlnos agreo on many points with the
H the national religion of Japan.
i
BT""""'""''' """""" '.. .. j0Mii 1 1 rjgMjgBsaroe
BITS OF FAR EASTERN NEW8.
Unimportant Compared to That of a
Few Months Ago.
Says tho Korea Dally News: ""Onco
upon a time Korea had a man-of-war.
She was a collier, painted white. Sho
was, at tho outbreak of hostilities
taken by tho Japancso as a collier
again. We have reason to believe
that sho Is nt the present time rest
ing under some twenty fathoms of
deep-blue sea. The Japanese minister
now has tho effrontery to send the
Korean government a bill for the
maintenance of this phantom ship.""
When the British invaded Tibet
under Col. Younghusband, the dalal
lama retreated from Lassa and but
little has been heard from him slnco.
The Pekln Times says, however: ""A
telegram from Mongolia reports tho
arrival of the dalai lama at Chlnghal
whero he desires to stop for the win
tor and proceed to Tibet in the
spring.""
According to the Manila Cablenewa
tho Japaneso navy has hoisted tho
Japanese flag over the Commander
Islands, which aro In Bering sea, be
tween Kamchatka and tho Aleutian
islands, tho latter belonging to tho
United States and the former to Bus
la. Tho Islands are unimportant and
are only valuable for fishing, having
no strategic advantage.
The Trustful French Nature.
Homery, the winner of the Vander
bllt cup, was being consoled with on
the destruction of his superb car.
""I was too trustful,"" said tho young
'Frenchman, with a rueful smile. ""I
let the people crowd around me, trust
ing them implicitly, never thinking
that any ono would be so careless
as to throw lighted matches about.
And hence pouf my car went up In
a mass of flames.""
Ho lighted a cigarette. Ho sipped
his coffee.
""To be too trustful,"" said Hemery,
""Is a fault of the French people.""
""A stranger once visited a mer
chant of Marseilles with a letter of in
troduction from Alexander Dumas. It
was a glowing letter. Tho merchant
welcomed the stranger warmly, and
entertained him with great hospital
ity for three weoks.
""Then, In tho night, tho guest dis
appeared, taking with him his host's
best horse and a quantity of silver
plute.
""The merchant, on his next visit to
Paris sought out Dumas.
'""A pretty guest you sent me,' he
said bitterly. 'The fellow decamped
with my best horse and plate, worth
5,000 francs.'
""'What!' cried Dumas, horror
stricken. 'Did ho steal from you,
too?' ""
A.
Two Klndr of Cheese In Essex.
Charles Samuel Story of Essox,
Mass., who is noted for witty sayings,
was In a well known grocer's store In
that town when a stranger came in.
Tho grocer was extremely slow when
waiting on a customer.
Tho stranger called for a pound of
cheese, and the grocer leaned ovor
tho counter in his slow way and
asked ""Will you havo tho now or
old?""
Story, who stood beside tho cus
tomer, saw that the stranger hesitated
so ho spoke In a hurried whisper, say
ing: ""Take the new; it will bo old
by the time you get It.""
The stranger called for tho new.
ww iiyii w i tin
MHMrtAPkylM-fpmpmri rrnuM ill iinii."".--
ADVICE FROM THE PROFESSOR.!
Perhaps Not Strictly In Order, but
Still Good Sense.
A young Southern lawyer sat In the
Supremo court in which Justice Hen
ry M. Glldersleevo was trying a case.
""This is the first t'mo I have ever
seen the Justice,"" be said, ""but if he's
as broad-minded as other members of
his family there'll bo no narrow ap
plication of the law in this case. A
relative of his, Prof. Glldersleove, was
my professor in tho University of Vir
ginia. I was in the same class of
which young Bradley Johnson, son of
the famous Confederate General of
that name, who died last fall, was a
member. One day several of us had
been out on a carouse and had failed
to appear for recitations. It was our
duty to report to Prof. Glldersleeve
and make our excuses. I think it was
I that was deputed to present the ex
cuse. I hadn't said much when the
professor broke in with a sternness
which made us wish wo couldn't tell
the difference between French wine
and corn whisky.
""'Young gentlemen,' he said, 'yon
must realize you havo entered upon
tho stern realities of life'
""Wo all bowed humbly, wondering
whether expulsion was to bo our fate.
'""Young gentlemen,' he added,
'never tnke It with water. I never
do. Good day, gentlemen.'"" New
York Times.
The Things We Eat.
Gregory E. Owens, a food Inspector
of Manchester, had an odd experience
the other day.
He was examining tho meat In a
small butcher shop on a back street.
Tho greater part of the meat was
fairly good, but there was one lot of
pork nnd beef that was rather ques
tionable. Tho butcher stood outsldo with a
customer. Tho Inspector called him
in.
""Look here,"" ho said, ""what Is your
opinion of this meat hero?""
Tho butcher looked It over.
""I had forgotten all about that,"" ho
said. ""It Is pretty old stock.""
""Well, what Is your opinion of It?""
""My opinion,"" said the butcher
slowly, ""Is that It Is unfit for human
food; but It might do for sausage.""
London Answers.
Predicts Long, Cold Winter.
Basing his prognostications on the
habits of the mole, an old mole-killer
In Olten, Switzerland, announces that
tho coming winter will bo the longest
and severest for the last fifteen
years, the moles having added two
deeper galleries to their usual winter
quarters, and laid in doublo tho ordi
nary provisions.
1 1 Lll.
Novelties and .Bargains in
Colored Wash Goods.
Our New Lints aro extonslvo in inngo,
vast in variety, rare in beauty, fashion
able in effect, worthy in quullty; and un
surpassed from tlio standpoint or oo no
ray. Of those things will you como and
l)o JuJko?
This offering1 will add to our famo of
matchlosa values.
Wool Finished Wash Balisies ,
A now fnbrlo for stroot and house
gowns that looks and feels like wool. A
soft beautiful wear that will qulokly
make hosts of friends, decidedly beauti
ful in Its variations of checks, stripes and
dots on cream grounds. It makes up
charmingly and is remarkably Inexpen
sive at this week's
I Special Price 20c, a yard.
ORPHEUM
MODERN VAUDEVILLE
Entrance on State Street
Both Phones 3569
Week Commencing Monday,
February 19, 1906
Mile Chester's Statue Dog
Thegrontcst Novelty bofore the Publlo
Wynne Winslow
The Pleasing Singer
Murphy and Willard
Presenting the Phrenologist
Tr ask and Rogers
Singers, Dancers and Comedians
Lambert and Pierce
The Two Mon In Mack
Second Week
Mr and Mrs Kclcy t
In tho Llttlo Comedy ""Uncle Millions'
The Kinodrome
Always Something Now
Every Evening (ExceptSunday),
75c SOc, 25c. Box Seats ?t.00
Matinees, Tues., Thurs., Sat.,
50c, 25c, 10c. Box Seats 75c
We Expect to Ship More Coal to This City
Next Summer Than Ever Before.
Given Plenty of Time, and a
Coal Famine in Severe Weather,
most anybody will Wise up and
store Coal in the Summer Time
rather than take chances on an
other shortage. '
What Are You Going To Do About It?
UTAH FUEL CO"
